{"schema_version":"1.0","plan_id":"abp_fixture_sustainability","revision_id":"abpr_fixture_sustainability_r1","parent_revision_id":null,"created_at":"2026-08-01T12:00:00.000Z","store_scope":{"organization_id":"org_fixture_sustainability","project_id":"prj_fixture_sustainability","merchant_scope_id":"mrc_fixture_sustainability"},"approval":{"approval_id":"aba_fixture_sustainability","approval_reference":"fixture-approved-sustainability-r1","approval_status":"approved","approver_type":"merchant","approved_at":"2026-08-01T12:00:00.000Z"},"default_locale":"en","content_entities":{"abpc_fixture_sustainability_packaging":{"content_id":"abpc_fixture_sustainability_packaging","content_type":"sustainability_initiative","localized_values":[{"locale":"en","field":"title","value":"Packaging review","value_type":"merchant_approved_text","approval_id":"aba_fixture_sustainability"},{"locale":"en","field":"text","value":"Fixture-only verified packaging practice.","value_type":"merchant_approved_text","approval_id":"aba_fixture_sustainability"},{"locale":"en","field":"icon","value":"recycle","value_type":"merchant_approved_text","approval_id":"aba_fixture_sustainability"}],"resource_reference_ids":[],"evidence_reference_ids":["abpe_fixture_sustainability_packaging"],"provenance":{"source_type":"evidence_backed","approval_id":"aba_fixture_sustainability","evidence_reference_ids":["abpe_fixture_sustainability_packaging"]}}},"resource_references":{},"evidence_references":{"abpe_fixture_sustainability_packaging":{"evidence_id":"abpe_fixture_sustainability_packaging","evidence_type":"sustainability_proof","source_type":"merchant_record","source_reference":"fixture-sustainability-evidence","approved_revision":"3333333333333333333333333333333333333333333333333333333333333333","approval_id":"aba_fixture_sustainability"}},"compositions":[{"composition_id":"abpcp_fixture_sustainability_home","page_role":"homepage","section_role":"sustainability_evidence","order":1,"visibility":{"mode":"always","conditions":[]},"presentation_intent":{"emphasis":"supporting","media_priority":"none","density":"balanced"},"block_placements":[{"placement_id":"abpl_fixture_sustainability_packaging","content_entity_id":"abpc_fixture_sustainability_packaging","semantic_block_role":"sustainability_initiative","order":1,"visibility":{"mode":"always","conditions":[]},"presentation_intent":{"emphasis":"supporting","media_priority":"none","density":"balanced"}}]}],"metadata":{"immutable":true,"source":"merchant_approved","migration":{"status":"native","source_revision_id":null,"migration_version":null}}}
