{"schema_version":"1.0","plan_id":"abp_fixture_timeline","revision_id":"abpr_fixture_timeline_r1","parent_revision_id":null,"created_at":"2026-08-01T12:00:00.000Z","store_scope":{"organization_id":"org_fixture_timeline","project_id":"prj_fixture_timeline","merchant_scope_id":"mrc_fixture_timeline"},"approval":{"approval_id":"aba_fixture_timeline","approval_reference":"fixture-approved-timeline-r1","approval_status":"approved","approver_type":"merchant","approved_at":"2026-08-01T12:00:00.000Z"},"default_locale":"en","content_entities":{"abpc_fixture_timeline_founding":{"content_id":"abpc_fixture_timeline_founding","content_type":"timeline_milestone","localized_values":[{"locale":"en","field":"date","value":"2014","value_type":"merchant_approved_text","approval_id":"aba_fixture_timeline"},{"locale":"en","field":"title","value":"Studio founded","value_type":"merchant_approved_text","approval_id":"aba_fixture_timeline"},{"locale":"en","field":"text","value":"Fixture-only merchant-confirmed founding milestone.","value_type":"merchant_approved_text","approval_id":"aba_fixture_timeline"},{"locale":"en","field":"icon","value":"calendar","value_type":"merchant_approved_text","approval_id":"aba_fixture_timeline"}],"resource_reference_ids":[],"evidence_reference_ids":["abpe_fixture_timeline_founding"],"provenance":{"source_type":"evidence_backed","approval_id":"aba_fixture_timeline","evidence_reference_ids":["abpe_fixture_timeline_founding"]}},"abpc_fixture_timeline_collection":{"content_id":"abpc_fixture_timeline_collection","content_type":"timeline_milestone","localized_values":[{"locale":"en","field":"date","value":"2019","value_type":"merchant_approved_text","approval_id":"aba_fixture_timeline"},{"locale":"en","field":"title","value":"First collection","value_type":"merchant_approved_text","approval_id":"aba_fixture_timeline"}],"resource_reference_ids":[],"evidence_reference_ids":["abpe_fixture_timeline_collection"],"provenance":{"source_type":"evidence_backed","approval_id":"aba_fixture_timeline","evidence_reference_ids":["abpe_fixture_timeline_collection"]}}},"resource_references":{},"evidence_references":{"abpe_fixture_timeline_founding":{"evidence_id":"abpe_fixture_timeline_founding","evidence_type":"merchant_confirmed_fact","source_type":"merchant_record","source_reference":"fixture-timeline-founding","approved_revision":"1111111111111111111111111111111111111111111111111111111111111111","approval_id":"aba_fixture_timeline"},"abpe_fixture_timeline_collection":{"evidence_id":"abpe_fixture_timeline_collection","evidence_type":"merchant_confirmed_fact","source_type":"merchant_record","source_reference":"fixture-timeline-collection","approved_revision":"2222222222222222222222222222222222222222222222222222222222222222","approval_id":"aba_fixture_timeline"}},"compositions":[{"composition_id":"abpcp_fixture_timeline_home","page_role":"homepage","section_role":"brand_timeline","order":1,"visibility":{"mode":"always","conditions":[]},"presentation_intent":{"emphasis":"supporting","media_priority":"none","density":"balanced"},"block_placements":[{"placement_id":"abpl_fixture_timeline_founding","content_entity_id":"abpc_fixture_timeline_founding","semantic_block_role":"timeline_item","order":1,"visibility":{"mode":"always","conditions":[]},"presentation_intent":{"emphasis":"supporting","media_priority":"none","density":"balanced"}},{"placement_id":"abpl_fixture_timeline_collection","content_entity_id":"abpc_fixture_timeline_collection","semantic_block_role":"timeline_item","order":2,"visibility":{"mode":"always","conditions":[]},"presentation_intent":{"emphasis":"supporting","media_priority":"none","density":"balanced"}}]}],"metadata":{"immutable":true,"source":"merchant_approved","migration":{"status":"native","source_revision_id":null,"migration_version":null}}}
