{"schema_version":"1.0","plan_id":"abp_fixture_recognition","revision_id":"abpr_fixture_recognition_r1","parent_revision_id":null,"created_at":"2026-08-01T12:00:00.000Z","store_scope":{"organization_id":"org_fixture_recognition","project_id":"prj_fixture_recognition","merchant_scope_id":"mrc_fixture_recognition"},"approval":{"approval_id":"aba_fixture_recognition","approval_reference":"fixture-approved-recognition-r1","approval_status":"approved","approver_type":"merchant","approved_at":"2026-08-01T12:00:00.000Z"},"default_locale":"en","content_entities":{"abpc_fixture_award":{"content_id":"abpc_fixture_award","content_type":"recognition","localized_values":[{"locale":"en","field":"kind","value":"award","value_type":"merchant_approved_text","approval_id":"aba_fixture_recognition"},{"locale":"en","field":"title","value":"Fixture design award","value_type":"merchant_approved_text","approval_id":"aba_fixture_recognition"},{"locale":"en","field":"issuer","value":"Fixture jury","value_type":"merchant_approved_text","approval_id":"aba_fixture_recognition"},{"locale":"en","field":"year","value":"2025","value_type":"merchant_approved_text","approval_id":"aba_fixture_recognition"},{"locale":"en","field":"icon","value":"award","value_type":"merchant_approved_text","approval_id":"aba_fixture_recognition"}],"resource_reference_ids":[],"evidence_reference_ids":["abpe_fixture_award"],"provenance":{"source_type":"evidence_backed","approval_id":"aba_fixture_recognition","evidence_reference_ids":["abpe_fixture_award"]}},"abpc_fixture_certification":{"content_id":"abpc_fixture_certification","content_type":"recognition","localized_values":[{"locale":"en","field":"kind","value":"certification","value_type":"merchant_approved_text","approval_id":"aba_fixture_recognition"},{"locale":"en","field":"title","value":"Fixture credential","value_type":"merchant_approved_text","approval_id":"aba_fixture_recognition"},{"locale":"en","field":"issuer","value":"Fixture verifier","value_type":"merchant_approved_text","approval_id":"aba_fixture_recognition"},{"locale":"en","field":"icon","value":"certificate","value_type":"merchant_approved_text","approval_id":"aba_fixture_recognition"}],"resource_reference_ids":[],"evidence_reference_ids":["abpe_fixture_certification"],"provenance":{"source_type":"evidence_backed","approval_id":"aba_fixture_recognition","evidence_reference_ids":["abpe_fixture_certification"]}}},"resource_references":{},"evidence_references":{"abpe_fixture_award":{"evidence_id":"abpe_fixture_award","evidence_type":"certification_proof","source_type":"merchant_record","source_reference":"fixture-award-evidence","approved_revision":"5555555555555555555555555555555555555555555555555555555555555555","approval_id":"aba_fixture_recognition"},"abpe_fixture_certification":{"evidence_id":"abpe_fixture_certification","evidence_type":"certification_proof","source_type":"merchant_record","source_reference":"fixture-certification-evidence","approved_revision":"6666666666666666666666666666666666666666666666666666666666666666","approval_id":"aba_fixture_recognition"}},"compositions":[{"composition_id":"abpcp_fixture_recognition_home","page_role":"homepage","section_role":"recognition_evidence","order":1,"visibility":{"mode":"always","conditions":[]},"presentation_intent":{"emphasis":"supporting","media_priority":"none","density":"balanced"},"block_placements":[{"placement_id":"abpl_fixture_award","content_entity_id":"abpc_fixture_award","semantic_block_role":"recognition","order":1,"visibility":{"mode":"always","conditions":[]},"presentation_intent":{"emphasis":"supporting","media_priority":"none","density":"balanced"}},{"placement_id":"abpl_fixture_certification","content_entity_id":"abpc_fixture_certification","semantic_block_role":"recognition","order":2,"visibility":{"mode":"always","conditions":[]},"presentation_intent":{"emphasis":"supporting","media_priority":"none","density":"balanced"}}]}],"metadata":{"immutable":true,"source":"merchant_approved","migration":{"status":"native","source_revision_id":null,"migration_version":null}}}
