{"schema_version":"1.0","plan_id":"abp_fixture_team","revision_id":"abpr_fixture_team_r1","parent_revision_id":null,"created_at":"2026-08-01T12:00:00.000Z","store_scope":{"organization_id":"org_fixture_team","project_id":"prj_fixture_team","merchant_scope_id":"mrc_fixture_team"},"approval":{"approval_id":"aba_fixture_team","approval_reference":"fixture-approved-team-r1","approval_status":"approved","approver_type":"merchant","approved_at":"2026-08-01T12:00:00.000Z"},"default_locale":"en","content_entities":{"abpc_fixture_team_member":{"content_id":"abpc_fixture_team_member","content_type":"team_member","localized_values":[{"locale":"en","field":"name","value":"Riley Morgan","value_type":"merchant_approved_text","approval_id":"aba_fixture_team"},{"locale":"en","field":"role","value":"Studio lead","value_type":"merchant_approved_text","approval_id":"aba_fixture_team"},{"locale":"en","field":"bio","value":"Fixture-only merchant-approved biography.","value_type":"merchant_approved_text","approval_id":"aba_fixture_team"}],"resource_reference_ids":[],"evidence_reference_ids":["abpe_fixture_team_member"],"provenance":{"source_type":"evidence_backed","approval_id":"aba_fixture_team","evidence_reference_ids":["abpe_fixture_team_member"]}}},"resource_references":{},"evidence_references":{"abpe_fixture_team_member":{"evidence_id":"abpe_fixture_team_member","evidence_type":"merchant_confirmed_fact","source_type":"merchant_record","source_reference":"fixture-team-evidence","approved_revision":"4444444444444444444444444444444444444444444444444444444444444444","approval_id":"aba_fixture_team"}},"compositions":[{"composition_id":"abpcp_fixture_team_home","page_role":"homepage","section_role":"team_directory","order":1,"visibility":{"mode":"always","conditions":[]},"presentation_intent":{"emphasis":"supporting","media_priority":"none","density":"balanced"},"block_placements":[{"placement_id":"abpl_fixture_team_member","content_entity_id":"abpc_fixture_team_member","semantic_block_role":"team_member","order":1,"visibility":{"mode":"always","conditions":[]},"presentation_intent":{"emphasis":"supporting","media_priority":"none","density":"balanced"}}]}],"metadata":{"immutable":true,"source":"merchant_approved","migration":{"status":"native","source_revision_id":null,"migration_version":null}}}
